{
  "type": "object",
  "required": [
    "x-city",
    "x-client-route",
    "x-key",
    "x-language",
    "x-logged"
  ],
  "$schema": "https://json-schema.org/draft/2020-12/schema",
  "properties": {
    "content-encoding": {
      "type": "string",
      "enum": [
        "gzip"
      ]
    },
    "traceparent": {
      "type": "string",
      "j2sEnumRejected": true
    },
    "x-city": {
      "type": "string",
      "j2sEnumRejected": true
    },
    "x-client-route": {
      "anyOf": [
        {
          "type": "null"
        },
        {
          "type": "string",
          "enum": [
            "/catalog"
          ]
        }
      ]
    },
    "x-key": {
      "type": "string",
      "j2sEnumRejected": true
    },
    "x-language": {
      "type": "string",
      "enum": [
        "ru"
      ]
    },
    "x-logged": {
      "type": "string",
      "j2sEnumRejected": true
    },
    "x-sigma-ip": {
      "type": "string",
      "j2sEnumRejected": true
    },
    "x-sigma-platform": {
      "type": "string",
      "enum": [
        "web"
      ]
    },
    "x-sigma-ua": {
      "type": "string",
      "j2sEnumRejected": true
    },
    "x-sigma-user-id": {
      "type": "string",
      "j2sEnumRejected": true
    }
  }
}