{
  "x-language": "ru",
  "x-city": "3",
  "x-key": "UnY0S1pOK09NY0sraTNyYUlRaFJZdz09OjpBVkRLZlVMcWF1aS8wZEppZVlTUjdBPT0=:877694bb30bad8cdaf6a905f6bb6055e",
  "x-logged": "",
  "x-client-route": "/catalog",
  "x-sigma-user-id": "UnY0S1pOK09NY0sraTNyYUlRaFJZdz09OjpBVkRLZlVMcWF1aS8wZEppZVlTUjdBPT0=:877694bb30bad8cdaf6a905f6bb6055e",
  "x-sigma-platform": "web",
  "x-sigma-ua": "",
  "x-sigma-ip": "",
  "traceparent": "00-a91ec628c02c6fa18efb75e048492dd3-a9a5a350baaac605-00",
  "content-encoding": "gzip"
}